{
  "canonical_id": "gemini",
  "aliases": ["google"],
  "trees": {
    "v1": {
      "primary_id": "gemini",
      "file": "v1/providers/gemini.yaml",
      "note": "LTS wire already uses canonical gemini; resolve google → gemini via alias map"
    },
    "v2": {
      "primary_id": "gemini",
      "file": "v2/providers/gemini.yaml",
      "aliases_on_manifest": ["google"],
      "note": "Evolution canonical; no google.yaml primary in this tree"
    },
    "v2-alpha": {
      "primary_id": "gemini",
      "file": "v2-alpha/providers/gemini.yaml",
      "graduation_target": "gemini",
      "note": "Sandbox already aligned on gemini; ensure aliases include google on graduation"
    }
  },
  "runtime_lookup": [
    "exact_id_match",
    "manifest_aliases",
    "normative_alias_map_for_v1",
    "fail_closed"
  ]
}
